<?xml version="1.0" encoding="UTF-8"?>
<!DOCTYPE CatalogoVOD SYSTEM "serviciovod_ep.dtd">
<CatalogoVOD>
    <!-- Cuenta 1 -->
    <cuenta correo="javs@syntax.com">
        <!-- Perfiles -->
        <perfiles>
            <!-- Perfil 1 -->
            <perfil usuario="Javs" idioma="Español" />
            <!-- Perfil 2 -->
            <perfil usuario="Gojo" idioma="Japonés" />
        </perfiles>
    </cuenta>

    <!-- Contenido -->
    <contenido>
        <!-- Género 1 -->
        <peliculas genero="Acción">
            <!-- Títulos de Películas -->
            <titulo nombre="Heart of Stone" duracion="122 minutos" region="USA" />
            <titulo nombre="The Mother" duracion="118 minutos" region="KOR" />
            <titulo nombre="Spiderman-A través del universo" duracion="140 minutos" region="ESP" />
            <titulo nombre="Spider-Man 3" duracion="139 minutos" region="MEX" />
        </peliculas>

        <!-- Género 2 -->
        <peliculas genero="Comedia">
            <!-- Títulos de Películas -->
            <titulo nombre="Son como niños" duracion="95 minutos" region="USA" />
            <titulo nombre="¿Dónde están las rubias?" duracion="100 minutos" region="USA" />
            <titulo nombre="Scary Movie" duracion="90 minutos" region="USA" />
            <titulo nombre="¿Y qué pasó ayer?" duracion="105 minutos" region="USA" />
        </peliculas>

        <!-- Géneros de Programas -->
        <series>
            <!-- Género 1 -->
            <genero nombre="Drama" region="USA" />
            <!-- Género 2 -->
            <genero nombre="Documental" region="USA" />
        </series>
    </contenido>
</CatalogoVOD>
